{
  "id": "driver-green-superseded",
  "role": "driver",
  "agent": { "kind": "claude", "config": { "role": "driver" } },
  "match": { "kind": "invoke-role", "role": "driver", "buildMode": "green-superseded" },
  "inputs": [
    { "id": "test-list", "source": "story:test-list-per-story.json", "description": "The story's tests the Driver makes GREEN after a superseded-test refactor re-opened the cycle." }
  ],
  "outputs": [],
  "routing": {
    "produced": { "next": "state-derived" }
  },
  "agentOptions": {
    "model": "sonnet",
    "effort": "default",
    "session": "resume",
    "resumeKeyFrom": "story"
  },
  "postTurn": [
    { "bin": "@build-cycle", "args": [], "when": "after" }
  ]
}
